{
    "metadata_id": "12345",
    "title": "Some title of the document",
    "description": "Some description of the document",
    "traits": {
        "named": {
            "name": "AppAgent name"
        },
        "finance.trevo.wallet.square_icon": {
            "image_url": "https://trevo-finance.github.io/trevo-traits-registry/examples/trait-logo-150.svg"
        }
    }
}