{
    "metadata_id": "12345",
    "title": "Some title of the document",
    "description": "Some description of the document",
    "traits": {
        "named": {
            "name": "Fungible token name"
        },
        "fungible": {
            "symbol": "FUNGIBLE",
            "decimals": 12
        },
        "finance.trevo.wallet.square_icon": {
            "image_url": "https://trevo-finance.github.io/trevo-traits-registry/examples/trait-logo-150.svg"
        },
        "finance.trevo.wallet.price_feed": {
            "current_price": {
                "source": "tiingo",
                "ticker": "NVDA"
            }
        }
    }
}